Category	File name	Title	Keywords	Abstract	Author	Author2	Author3	Author4
Article	Subssions/Article-1.pdf	Title of article 1	Ruby, Java, C++, Python, Programming Languages	This is an article that presents programing languages.	Ana	Beto		
Article	Subssions/Article-2.pdf	Title of article 2	Surf, Soccer, Tennis, Diving, Sport	This is an article about sports.	Charles	Davi	Elias	
Article	Subssions/Article-3.pdf	Other article	Sport, Water, Winter	How to do sports in the water  during the winter.	Aquaman			
Banner	Subssions/Banner-1.pdf	Banner title 1	Madonna, Michel Jackson, Pavarotti, Music	This is a banner about the music world	Fatima			
Banner	Subssions/Banner-2.pdf	Banner title 2		This is a banner about the history.	Ghotë			
Short	Subssions/Short-1.pdf	The life after life	After life, Ghosts, Spirit		Kardec	Gabriel Delane		
